{
  "schemaVersion": 1,
  "candidateId": "t2-p8-followup-v1",
  "publicationStatus": "candidate-only",
  "independentVerification": "not-performed",
  "baseContractDigest": "sha256:e93f30f75b97f580d3ee0984ff4300bb7a35544a4568a0fedfabf32da81e1ec4",
  "baseSchemaDigest": "sha256:2fa7fb0dc0e0f9f389054ec4825fcb3f341e64aa7a36d932bf31a0ff53813c26",
  "sourceDescriptor": {
    "ruleId": "cold-start-not-after-regulation",
    "sourceClauseIds": [
      "req:FR-014",
      "req:DRAW-03"
    ],
    "regulationRepresentatives": [
      1,
      9,
      99
    ],
    "startInningOffsets": [
      -1,
      0,
      1
    ],
    "tierOrders": [
      "single",
      "first",
      "last"
    ]
  },
  "ruleValidationCases": [
    {
      "caseId": "GE-RULE-COLD-R1-OFFSET0-single",
      "ruleSnapshot": {
        "regulationInnings": 1,
        "coldConditions": [
          {
            "pointDifference": 1,
            "startInning": 1
          }
        ],
        "extensionLimit": null,
        "tiebreak": null,
        "dh": false
      },
      "expected": "not-rejected-by-this-rule",
      "sourceClauseIds": [
        "req:FR-014",
        "req:DRAW-03"
      ]
    },
    {
      "caseId": "GE-RULE-COLD-R1-OFFSET0-first",
      "ruleSnapshot": {
        "regulationInnings": 1,
        "coldConditions": [
          {
            "pointDifference": 1,
            "startInning": 1
          },
          {
            "pointDifference": 2,
            "startInning": 1
          }
        ],
        "extensionLimit": null,
        "tiebreak": null,
        "dh": false
      },
      "expected": "not-rejected-by-this-rule",
      "sourceClauseIds": [
        "req:FR-014",
        "req:DRAW-03"
      ]
    },
    {
      "caseId": "GE-RULE-COLD-R1-OFFSET0-last",
      "ruleSnapshot": {
        "regulationInnings": 1,
        "coldConditions": [
          {
            "pointDifference": 2,
            "startInning": 1
          },
          {
            "pointDifference": 1,
            "startInning": 1
          }
        ],
        "extensionLimit": null,
        "tiebreak": null,
        "dh": false
      },
      "expected": "not-rejected-by-this-rule",
      "sourceClauseIds": [
        "req:FR-014",
        "req:DRAW-03"
      ]
    },
    {
      "caseId": "GE-RULE-COLD-R1-OFFSET1-single",
      "ruleSnapshot": {
        "regulationInnings": 1,
        "coldConditions": [
          {
            "pointDifference": 1,
            "startInning": 2
          }
        ],
        "extensionLimit": null,
        "tiebreak": null,
        "dh": false
      },
      "expected": "reject",
      "sourceClauseIds": [
        "req:FR-014",
        "req:DRAW-03"
      ]
    },
    {
      "caseId": "GE-RULE-COLD-R1-OFFSET1-first",
      "ruleSnapshot": {
        "regulationInnings": 1,
        "coldConditions": [
          {
            "pointDifference": 1,
            "startInning": 2
          },
          {
            "pointDifference": 2,
            "startInning": 1
          }
        ],
        "extensionLimit": null,
        "tiebreak": null,
        "dh": false
      },
      "expected": "reject",
      "sourceClauseIds": [
        "req:FR-014",
        "req:DRAW-03"
      ]
    },
    {
      "caseId": "GE-RULE-COLD-R1-OFFSET1-last",
      "ruleSnapshot": {
        "regulationInnings": 1,
        "coldConditions": [
          {
            "pointDifference": 2,
            "startInning": 1
          },
          {
            "pointDifference": 1,
            "startInning": 2
          }
        ],
        "extensionLimit": null,
        "tiebreak": null,
        "dh": false
      },
      "expected": "reject",
      "sourceClauseIds": [
        "req:FR-014",
        "req:DRAW-03"
      ]
    },
    {
      "caseId": "GE-RULE-COLD-R9-OFFSET-1-single",
      "ruleSnapshot": {
        "regulationInnings": 9,
        "coldConditions": [
          {
            "pointDifference": 1,
            "startInning": 8
          }
        ],
        "extensionLimit": null,
        "tiebreak": null,
        "dh": false
      },
      "expected": "not-rejected-by-this-rule",
      "sourceClauseIds": [
        "req:FR-014",
        "req:DRAW-03"
      ]
    },
    {
      "caseId": "GE-RULE-COLD-R9-OFFSET-1-first",
      "ruleSnapshot": {
        "regulationInnings": 9,
        "coldConditions": [
          {
            "pointDifference": 1,
            "startInning": 8
          },
          {
            "pointDifference": 2,
            "startInning": 1
          }
        ],
        "extensionLimit": null,
        "tiebreak": null,
        "dh": false
      },
      "expected": "not-rejected-by-this-rule",
      "sourceClauseIds": [
        "req:FR-014",
        "req:DRAW-03"
      ]
    },
    {
      "caseId": "GE-RULE-COLD-R9-OFFSET-1-last",
      "ruleSnapshot": {
        "regulationInnings": 9,
        "coldConditions": [
          {
            "pointDifference": 2,
            "startInning": 1
          },
          {
            "pointDifference": 1,
            "startInning": 8
          }
        ],
        "extensionLimit": null,
        "tiebreak": null,
        "dh": false
      },
      "expected": "not-rejected-by-this-rule",
      "sourceClauseIds": [
        "req:FR-014",
        "req:DRAW-03"
      ]
    },
    {
      "caseId": "GE-RULE-COLD-R9-OFFSET0-single",
      "ruleSnapshot": {
        "regulationInnings": 9,
        "coldConditions": [
          {
            "pointDifference": 1,
            "startInning": 9
          }
        ],
        "extensionLimit": null,
        "tiebreak": null,
        "dh": false
      },
      "expected": "not-rejected-by-this-rule",
      "sourceClauseIds": [
        "req:FR-014",
        "req:DRAW-03"
      ]
    },
    {
      "caseId": "GE-RULE-COLD-R9-OFFSET0-first",
      "ruleSnapshot": {
        "regulationInnings": 9,
        "coldConditions": [
          {
            "pointDifference": 1,
            "startInning": 9
          },
          {
            "pointDifference": 2,
            "startInning": 1
          }
        ],
        "extensionLimit": null,
        "tiebreak": null,
        "dh": false
      },
      "expected": "not-rejected-by-this-rule",
      "sourceClauseIds": [
        "req:FR-014",
        "req:DRAW-03"
      ]
    },
    {
      "caseId": "GE-RULE-COLD-R9-OFFSET0-last",
      "ruleSnapshot": {
        "regulationInnings": 9,
        "coldConditions": [
          {
            "pointDifference": 2,
            "startInning": 1
          },
          {
            "pointDifference": 1,
            "startInning": 9
          }
        ],
        "extensionLimit": null,
        "tiebreak": null,
        "dh": false
      },
      "expected": "not-rejected-by-this-rule",
      "sourceClauseIds": [
        "req:FR-014",
        "req:DRAW-03"
      ]
    },
    {
      "caseId": "GE-RULE-COLD-R9-OFFSET1-single",
      "ruleSnapshot": {
        "regulationInnings": 9,
        "coldConditions": [
          {
            "pointDifference": 1,
            "startInning": 10
          }
        ],
        "extensionLimit": null,
        "tiebreak": null,
        "dh": false
      },
      "expected": "reject",
      "sourceClauseIds": [
        "req:FR-014",
        "req:DRAW-03"
      ]
    },
    {
      "caseId": "GE-RULE-COLD-R9-OFFSET1-first",
      "ruleSnapshot": {
        "regulationInnings": 9,
        "coldConditions": [
          {
            "pointDifference": 1,
            "startInning": 10
          },
          {
            "pointDifference": 2,
            "startInning": 1
          }
        ],
        "extensionLimit": null,
        "tiebreak": null,
        "dh": false
      },
      "expected": "reject",
      "sourceClauseIds": [
        "req:FR-014",
        "req:DRAW-03"
      ]
    },
    {
      "caseId": "GE-RULE-COLD-R9-OFFSET1-last",
      "ruleSnapshot": {
        "regulationInnings": 9,
        "coldConditions": [
          {
            "pointDifference": 2,
            "startInning": 1
          },
          {
            "pointDifference": 1,
            "startInning": 10
          }
        ],
        "extensionLimit": null,
        "tiebreak": null,
        "dh": false
      },
      "expected": "reject",
      "sourceClauseIds": [
        "req:FR-014",
        "req:DRAW-03"
      ]
    },
    {
      "caseId": "GE-RULE-COLD-R99-OFFSET-1-single",
      "ruleSnapshot": {
        "regulationInnings": 99,
        "coldConditions": [
          {
            "pointDifference": 1,
            "startInning": 98
          }
        ],
        "extensionLimit": null,
        "tiebreak": null,
        "dh": false
      },
      "expected": "not-rejected-by-this-rule",
      "sourceClauseIds": [
        "req:FR-014",
        "req:DRAW-03"
      ]
    },
    {
      "caseId": "GE-RULE-COLD-R99-OFFSET-1-first",
      "ruleSnapshot": {
        "regulationInnings": 99,
        "coldConditions": [
          {
            "pointDifference": 1,
            "startInning": 98
          },
          {
            "pointDifference": 2,
            "startInning": 1
          }
        ],
        "extensionLimit": null,
        "tiebreak": null,
        "dh": false
      },
      "expected": "not-rejected-by-this-rule",
      "sourceClauseIds": [
        "req:FR-014",
        "req:DRAW-03"
      ]
    },
    {
      "caseId": "GE-RULE-COLD-R99-OFFSET-1-last",
      "ruleSnapshot": {
        "regulationInnings": 99,
        "coldConditions": [
          {
            "pointDifference": 2,
            "startInning": 1
          },
          {
            "pointDifference": 1,
            "startInning": 98
          }
        ],
        "extensionLimit": null,
        "tiebreak": null,
        "dh": false
      },
      "expected": "not-rejected-by-this-rule",
      "sourceClauseIds": [
        "req:FR-014",
        "req:DRAW-03"
      ]
    },
    {
      "caseId": "GE-RULE-COLD-R99-OFFSET0-single",
      "ruleSnapshot": {